objectid,title,format,filename,date,subject,location,latitude,longitude,description
item1,landscape of waterford ponds 1,image/JPG,waterfordponds1.jpg,2018-07-07,waterford ponds; lily pads; long grass; mud; trees; log,waterford on,42.933228,-80.299254,A park in the city
item2,landscape of waterford ponds 2,image/JPG,waterfordponds2.pdf,2018-07-07,waterford ponds; park bench; trees; grass,waterford on,42.933228,-80.299254,A park in the city
item3,landscape of waterford ponds grass,image/JPG,waterfordpondsgrass.jpg,2018-07-07,waterford ponds; lily pads; long grass; trees; log; houses,waterford on,42.933228,-80.299254,A park in the city
item4,landscape of waterford ponds trees,image/JPG,waterfordpondstrees.jpg,2018-07-07,waterford ponds; park bench; trees; grass,waterford on,42.933228,-80.299254,A park in the city
item5,landscape of waterford ponds with greg and pollee,image/jPG,waterfordpondswithgregandpollee.jpg,2018-07-07,waterford ponds; lily pads; long grass; mud; trees; log; greg; pollee,waterford on,42.933228,-80.299254,A park in the city
